{"kind":"friction","machine":"workstation-a","model":"claude-fable-5-1","payload":{"category":"docs-and-config","details":"d","fix_ref":"rrrrrrrrrrrrrrrrrrrrrrrrrrrrrrrrrrrrrrrrrrrrrrrrrrrrrrrrrrrrrrrrrrrrrrrrrrrrrrrrrrrrrrrrrrrrrrrrrrrrrrrrrrrrrrrrrrrrrrrrrrrrrrrrrrrrrrrrrrrrrrrrrrrrrrrrrrrrrrrrrrrrrrrrrrrrrrrrrrrrrrrrrrrrrrrrrrrrrrrrr","fix_status":"maybe","severity":"high"},"schema_version":1,"summary":"the linter ignores its config file"}