{"kind":"friction","summary":"                                                                                                                                                                                                                                                                                                                                                                                                                                                                                                                                                                                                                                                                                                                                                                                                                                                                                                                                                                                                                                                                                                                                                                                                                                                                                                                                                                                                                                                                                                                                                                                                                                                                                                                                                                                                                                                                                                                                                                                                                                                                      abcdefghijklmnopqrstuvwxyz","machine":"workstation-a","model":"claude-fable-5-1","payload":{"category":"tooling","details":"expected .lintrc to apply; it did not"}}