{"harness":"claude-code-xxxxxxxxxxxxxxxxxxxxxxxxxxxxxxxxxxxxxxxxxxxxxxxxxxxxxxxxxxxxxxxxxxxxxxxxxxxxxxxxxxxxxxxxxxxxxxxxxxxxxxxxxxxxxxxxxxxxxxxxxxxxxxxxxxxxxxxxxxxxxxxxxxxxxxxxxxxxxxxxxxxxxxxxxxxxxxxxxxxxxxxxxxxx","kind":"friction","machine":"workstation-a","model":"claude-fable-5-1","payload":{"category":"tooling","details":"expected .lintrc to apply; it did not"},"schema_version":1,"summary":"the linter ignores its config file"}