{"context":{"c00":"v","c01":"v","c02":"v","c03":"v","c04":"v","c05":"v","c06":"v","c07":"v","c08":"v","c09":"v","c10":"v","c11":"v","c12":"v","c13":"v","c14":"v","c15":"v","c16":"v","c17":"v","c18":"v","c19":"v","c20":"v","c21":"v","c22":"v","c23":"v","c24":"v","c25":"v","c26":"v","c27":"v","c28":"v","c29":"v","c30":"v","c31":"v"},"kind":"friction","machine":"m","model":"x","payload":{"category":"tooling","context_overflow":1,"details":"d","moved":{"context_overflow":{"zz":{"a":"�"}},"value":2}},"schema_version":1,"summary":"s"}