{"kind":"friction","summary":"the linter ignores its config file","machine":"workstation-a","model":"claude-fable-5-1","payload":{"category":"tooling","details":"expected .lintrc to apply; it did not"},"context":{"origin":"session-scan","detector":"agentfeedback-sessions/1","session_harness":"codex"}}