{"kind":"friction","machine":"workstation-a","model":"claude-fable-5-1","payload":{"a":1.0,"b":1e2,"c":1E2,"category":"tooling","d":-0,"details":"expected .lintrc to apply; it did not","e":0.10,"f":12345678901234567890123,"g":1e400,"h":-1.5e-3},"schema_version":1,"summary":"the linter ignores its config file"}