{"kind":"friction","machine":"workstation-a","model":"claude-fable-5-1","payload":{"category":"tooling","details":"d","evidence":[{"at":"2026-10-07T09:58:12Z","command":"go test ./pkg/store","count":"3","error":"exit 1","span":"s12","tool":"bash"},{"at":"yesterday","count":3,"extra":true,"tool":"bash"},"not an object"]},"schema_version":1,"summary":"tests failed on a missing fixture"}