{"context":{"Z":"sorts first","c00":"v0","c01":"v1","c02":"v2","c03":"v3","c04":"v4","c05":"v5","c06":"v6","c07":"v7","c08":"v8","c09":"v9","c10":"v10","c11":"v11","c12":"v12","c13":"v13","c14":"v14","c15":"v15","c16":"v16","c17":"v17","c18":"v18","c19":"v19","c20":"v20","c21":"v21","c22":"v22","c23":"v23","c24":"v24","c25":"v25","c26":"v26","c27":"v27","c28":"v28","c29":"v29","c30":"v30"},"kind":"friction","machine":"workstation-a","model":"claude-fable-5-1","payload":{"category":"tooling","context_overflow":{"c31":"v31"},"details":"expected .lintrc to apply; it did not"},"schema_version":1,"summary":"the linter ignores its config file"}