{"harness":"claude-code","kind":"friction","machine":"workstation-a","model":"claude-fable-5-1","payload":{"category":"tooling","details":"expected .lintrc to apply; it did not","u001":1,"u002":1,"u003":1,"u004":1,"u005":1,"u006":1,"u007":1,"u008":1,"u009":1,"u010":1,"u011":1,"u012":1,"u013":1,"u014":1,"u015":1,"u016":1,"u017":1,"u018":1,"u019":1,"u020":1,"u021":1,"u022":1,"u023":1,"u024":1,"u025":1,"u026":1,"u027":1,"u028":1,"u029":1,"u030":1,"u031":1,"u032":1,"u033":1,"u034":1,"u035":1,"u036":1,"u037":1,"u038":1,"u039":1,"u040":1,"u041":1,"u042":1,"u043":1,"u044":1,"u045":1,"u046":1,"u047":1,"u048":1,"u049":1,"u050":1,"u051":1,"u052":1,"u053":1,"u054":1,"u055":1,"u056":1,"u057":1,"u058":1,"u059":1,"u060":1,"u061":1,"u062":1,"u063":1,"u064":1,"u065":1,"u066":1,"u067":1,"u068":1,"u069":1,"u070":1,"u071":1,"u072":1,"u073":1,"u074":1,"u075":1,"u076":1,"u077":1,"u078":1,"u079":1,"u080":1,"u081":1,"u082":1,"u083":1,"u084":1,"u085":1,"u086":1,"u087":1,"u088":1,"u089":1,"u090":1,"u091":1,"u092":1,"u093":1,"u094":1,"u095":1,"u096":1,"u097":1,"u098":1,"u099":1,"u100":1,"u101":1,"u102":1,"u103":1,"u104":1,"u105":1,"u106":1,"u107":1,"u108":1,"u109":1,"u110":1,"u111":1,"u112":1,"u113":1,"u114":1,"u115":1,"u116":1,"u117":1,"u118":1,"u119":1,"u120":1,"u121":1,"u122":1,"u123":1,"u124":1,"u125":1,"u126":1,"u127":1,"u128":1,"u129":1,"u130":1,"u131":1,"u132":1,"u133":1,"u134":1,"u135":1,"u136":1,"u137":1,"u138":1,"u139":1,"u140":1,"u141":1,"u142":1,"u143":1,"u144":1,"u145":1,"u146":1,"u147":1,"u148":1,"u149":1,"u150":1},"project":"agentfeedback","schema_version":1,"summary":"the linter ignores its config file"}