{"kind":"friction","summary":"the linter ignores its config file","machine":"workstation-a","model":"claude-fable-5-1","payload":{"category":"  Docs   And Config ","details":"d","fix_status":"maybe","fix_ref":"rrrrrrrrrrrrrrrrrrrrrrrrrrrrrrrrrrrrrrrrrrrrrrrrrrrrrrrrrrrrrrrrrrrrrrrrrrrrrrrrrrrrrrrrrrrrrrrrrrrrrrrrrrrrrrrrrrrrrrrrrrrrrrrrrrrrrrrrrrrrrrrrrrrrrrrrrrrrrrrrrrrrrrrrrrrrrrrrrrrrrrrrrrrrrrrrrrrrrrrrr","severity":"high"}}